Jay Z has 11 years on Beyonce. Yo future wife could be chillin in 3rd grade just tryna do her multiples of 5 rn. https://t.co/OidHWDbxpP|1
I was gonna wait to buy weed until Monday, but I just realized watching Beyonce's concert might be so much better with a blunt.|1
Little Monday morning inspiration from Bob Marley. "Possession make you rich? I don't have that type of richness"https://t.co/HsyddmVcEX|1
It's Monday!"Get up, Stand up! Don't give up the fight" - Bob Marley#bestinlombok #happymonday #monday #quote... http://t.co/QJiDygRyAJ|1
Good Thursday #np Bob Marley - Could you be Loved #Legend http://t.co/2ZG0nqJrkE|1
One of those Monday mornings where you just have Beyonce's 'Blow" remix with Pharell in your head, yano.|1
Legs be having you: Beyonce returned to her diva best as she strutted back on to the stage on Saturday night http://t.co/1tOF5PtxrK|1
MusicTimes&gt; Beyonce - The audience at Saturday's 2015 Budweiser Made in America Festival fell "Crazy in Love" with... http://t.co/1rp0SAlmgO|1
Bob Marley playing in the lab. Happy Saturday!!|1
Sun Is Shining by Bob Marley &amp; The Wailers, found with @Shazam. Listen now: http://t.co/kWi7EHPvQ2|1
Join us at  Red Magazine Smart Women Week for a signature Beyonce Dance Workshop. 3-4:30pm next Friday the 18th... http://t.co/jIzK5DAPsv|1
Your #Saturday #Satisfactionwith Beyonce - Irreplaceable (Irreemplazable)http://t.co/CvHFOMO1tN#zaterdag #samedi|1
Sun is shining, weather is sweet, makes you wanna move your dancin feet - Bob Marley|1
Beyonce is probably the best female Virgo I never met, 2nd to my girl @yahtesh lol|1
And if ur saturday night ain't planned around Beyonce at MIA, we def not the same|1
@antoinettemot you nailed it! GET d tickets 1ST to Beyonce's concerts! get http://t.co/QRb6XUAIQT http://t.co/XBxSeCoPfP|1
"how did you spend your saturday night?"i celebrated beyonce's birthday with her|1
We are sponsoring the Newport Comedy Series this Friday night with Bob Marley performing at the Hyatt on Goat... http://t.co/VT69MiReMr|1
I wasn't even lit anymore by the time Beyonce came on. Gotta do better tomorrow lol|1
I'll be be watching Beyonce's MIA performance a lil later. I just need to ready myself 1st. Lol|1
@mggtTaylor One Alanis Morissette Sun is Shining Bob MarleyWake the Town URoyReckoner Radiohead Vibrate Outcast|1
1st putter of the Bob Marley down! @ Cirque Daiquiri Bar and Grill https://t.co/RNKbDCYuXN|1
" Sun is shining, the weather is sweet..." (Bob Marley) https://t.co/nMeA6cH6ZR|1
He plays an American so well...I mean, acting alongside Beyonce would make any other person run back to Britain.  https://t.co/6Q7Kgqbd6c|1
What on: Summer Superstar Spectacular Presents Legend: A Tribute To Bob Marley: Every Wednesday through the su... http://t.co/QsuRzpMKsr|1
The sun is shining. I'm writing from my deck. It just seems like a Bob Marley kind of day. I just need rum.|1
I just realized I saw JB &amp; Beyonce both for the first time on September 5th. This has to be a sign of something http://t.co/H3IWUk6pkS|1
#newsupdate Showing off the real Jamaica through Bob Marley shooting: Author uses Bob Mar... http://t.co/0heiEhkZYx #bbc #news #bbcupdat|1
I was really upset on Friday night and I laid my head on my 'friends' lap he hugged me then began to sing 3 little birds by Bob Marley|1
Sat in bed singing along to Beyonce tracks as if i sound like the queen herself... #listen #irreplacable #ifiwereaboy #myvoiceisflawless|1
You know you washed when you defending Beyonce on Instagram on a Saturday night.|1
Tomorrow we'll release our 58th episode of #HSonAir profiling our very own @AlissaDosSantos ! We'll talk about storytelling and Beyonce!|1
Beyonce is really just the 8th wonder of the world|1
@MsHeatherBeaver I feel like you'd rate this one a close 2nd to them doing the Beyonce mix.  https://t.co/kSQss0fUor|1
The only feminist manifesto  (if I may call it) that am exposed to is the one in Beyonce's flawless http://t.co/dPHtZij3ar|1
1ST GOP DEBATE WRAP UP: Bobby Jindal made 2nd place during the first round. Hope he can keep this up. good job Bobby!|1
@JohnFugelsang @GrnEyedMandy bobby Jindal is just trying to score political points and get into the debate Thursday|-1
@_TheRandall @colinwright1959 Without googling I can only think of a couple! Sun is shining - Bob Marley &amp; house of the rising sun!|1
@TheYoungTurks @cenkuygur HELP!! Bobby Jindal has just doomed Louisana. http://t.co/EZ0VM6p326 http://t.co/RoQWR3kPn3|-1
Our Gov: Bobby Jindal is the smartest Republican among all! Mr.Jindal is the re-incarnation of Robert Kennedy! Fear  http://t.co/RVfKZyzQe2|1
Bobby Jindal just PROVED he is not worthy of running for president of USA - HE CANCELLED PLANNED PARENTOOD IN lA. https://t.co/ohSsL2WMly|-1
Yet it's never the right time to talk gun control. Right, Bobby Jindal? https://t.co/NtdlW7PLUt|-1
"Defund PP!" Says Bobby Jindal, governor of the State with the 5th highest teen pregnancy rate in the nation...Maybe no, Bobby.|-1
If you enjoyed the episode on the 2nd Amendment, check out this Atlantic article on Bobby Jindal and guns:http://t.co/dHiDsozXSn|1
#NowPlaying in the Treehouse :  Bob Marley Vs. Funkstar De Luxe - Sun Is Shining  ... Tune In at http://t.co/9N5DBXQp9E|1
#NHForum live: http://t.co/G0L1s5Otwq Bobby Jindal said 1st thing, he'd repeal O's executive orders (immigration, EPA...) #TCOT #PJNET #CCOT|-1
Sweet Sunday morning with the King...Bob Marley #reggaemusic #emancipateyourself http://t.co/Xd9XUPucGv|1
Bob Marley fans, your dream will come true soon as @bobmarley and the Wailers is coming to perform, Sept 7 at Explosition Park, #LosAngeles.|1
My co-worker named our printer Bob Marley because "he always be jamming." I genuinely laughed out loud. Friday's are the best. Love my job.|1
Have a top Wednesday! #Album4Work Kaya - Bob Marley &amp; the Wailers https://t.co/2daRLzgrp2 http://t.co/jkz2GNNTBM|1
Who is funding these Chris Christie ads? St Jude couldn't get him the nomination. May as well be Bobby Jindal.|-1
@DocThompsonShow @skiplacombe Did you see Bobby Jindal's comments on Westborough Church? No respect for 1st amendment maybe #notthatguy|-1
@ThePeoplesBacon @maddow @msnbc Maddow was right. #FoxNews did a hit job on the 2nd tier candidates. Not that I care about Bobby Jindal.|-1
Some people feel the rain. Others just get wet - Bob Marley - Happy Wednesday.|1
Um...Bobby Jindal (&amp; Scott Walker) don't love America or its Constitution--particularly the 14th Amend @eliasisquith https://t.co/iUtkPwBH7H|-1
Bob Marley and the wailers - Sun Is Shining http://t.co/z8w5pmI8T5 #nowplaying #listenlive|1
@RadioLaB971fm just back from doing a car boot . Bring the sun back with some Bob Marley.|1
#nowplaying Bob Marley - Sun Is Shining on Surf Shack Radio, The Best Mix of Music on the Beach|1
I saw something hideous &amp; disgusting on the road side.Broken &amp; long dead.It not sure, but it may have been Bobby Jindal's last scruple.|-1
I think Bobby Jindal will surprise a lot of people at the early debate on Thursday. He isn't getting any attention. #tcot|1
Bobby Jindal may not be the best speaker, but he is a solid conservative, has experience governing and seems to be an honest man.|1
Elbert Guillory's using the n-word in his latest ad. Also in La La Land, Mary cuts lose on Bobby Jindal  http://t.co/rePjcogxT6|-1
Winding down the Sunday with Bob Marley on #vinyl. http://t.co/8fWRakgeCp|1
@WEBmover @greta the one that I liked the 2nd best was Bobby Jindal.|1
Monday Afternoon Love Muse from the Legend himself Mr Bob Marley! http://t.co/x8qsdzWs99|1
Whoa. Bobby Jindal. Get a new speech dude. That was word-for-word the same as the one this past Monday. @BobbyJindal @FoxNews #GOPDebate|-1
I used to have the dopest bob Marley shirt for tomorrow but now it's gone:`(|1
Excited for the end of the 1st debate when Ryan Seacrest comes out and says, "Bobby Jindal, your Idol journey ends here" and he cries.|-1
"Open your eyes, look within. Are you satisfied with the life you're living?" --Bob MarleyTUESDAY SCHEDULE... http://t.co/OVidXaT4xM|1
Louisiana Gov. Bobby Jindal on Wednesday mocked Hillary Clinton with a prison joke about the latest developments... http://t.co/LsgohgjTxe|-1
Rise up this mornin'. Smile with risin' sun - Bob Marley! Happy Friday everyone. Today we have mint chocolate... http://t.co/RwT04XND2i|1
Daily Skimm: I like the way you move http://t.co/W1nLTYTmIY. Nice info on Bobby Jindal,|1
@cannabox @BreezyPuffs  Classic "Sun Is Shining" by Bob Marley. Tell me you can't get chill with that. Since before you were born,girl!|1
Looking forward to listening to Bob Marley during the bus ride after the cross country meet on Saturday #BobMarley #running #peace|1
Sun is shining... Bob Marley on the radio... hiya Monday!|1
It may be because I'm listening to the #GOPDebate on the radio, but Bobby Jindal sounds like Kermit the Frog. I like him though.|1
I don't think there's a better way to start a Sunday than with Bob Marley|1
Happy Monday everyone ! Have a nice day with "Stir It Up" from Bob Marley http://t.co/aYCdD86S8o #shopinsidermorning|1
@BobbyJindal @FoxNews  I was very sad to hear this. We love you Bobby Jindal and May God Bless you and protect you|1
@TheRealEve What happened to the track Here I Am? It had a Bob Marley sample from Sun is Shining. Track sounded nice. Can you release it?|1
@RichardDawkins Bob Marley may be evidence that cannabis makes you cool as shit. #bobmaley|1
Make like Bob Marley and get Jammin! Jam Night at The Sun Inn, Saxilby - 8pm tonight http://t.co/HaZOfzsrtk #Saxilby #JamNight|1
"Woke up this morning, smiled with the rising sun...singing sweet songs of melodies pure and true!" - Bob Marley http://t.co/DtnEzQFaFg|1
Bobby Jindal will repeal the 14th amendment this guy would crawl over his dead mother just to fuck his sister for a pencil he deport himself|-1
It's #house Thursday..."when music hits u feel no pain" Hon.Bob Marley said that have a lovely day fam|1
@BBUKLive wake them up with the legendary Bob Marley the sun is shining|1
My good mate Bob Marley, as you may have never heard him before https://t.co/aEmdO9Msnf|1
I'm wearing a bob Marley shirt for picture day tomorrow and idc idc|1
Many reasons why #AskBobby is wrong: he's Bobby Jindal; he's @GOP; he's Louisianan; he loves @NRA contributions &amp; gun. There may B others.|-1
Bobby Jindal wants you to assimilate to heritage of the old confederacy even though his parents are from January dot dot dot|-1
TOMORROW NIGHT - JAMROCK Hull @Tofts_Lane_Hull with guest Tanni Browne doing his Bob Marley tribute act http://t.co/1s09m5pIjZ|1
Audio: digitallioness: Justin Nozuka Band- Mr Therapy Man/ Sun is Shining (Bob Marley cover) This is the... http://t.co/iMAXxzsXfp|1
If Bob Marley were alive he'd ne reppin' #JamRock tomorrow NYT...Jah Bless. Let's meet @Ahomka995 fm forecourt n make history|1
Bob Marley's "Stir it Up" in Birmingham from our gig on Saturday, enjoy&gt;&gt;&gt; https://t.co/2uDudJddCO#BobMarley #Birmingham|1
Going to the beach? Listen to Bob Marley: Kick back, relax, and enjoy the sun as Thomas H Green selects the be... http://t.co/gMiTAo3jb4|1
When I have kids, every morning, we are all going to wake up with the sun and dance to Bob Marley like one big happy family.|1
#DYK Bob Marley was voted the 3rd greatest lyricist of all time by @BBC News online users, following Bob Dylan and John Lennon|1
At last ! a little bit of Indian #Summer for the #NetherlandsBob Marley &amp; Funk Star Deluxe - Sun is shining (REMIX)https://t.co/CNSWfw8KZ2|1
My last post talked about listening to Bob Marley on a Thursday.This Thursday I'm dealing with a house on fire.#multi-skilled|1
Bobby Jindal why do you hate women? Planned parenthood may be only access to reproductive health care. @BobbyJindal #StandwithPP|-1
I'm sitting on this bench alone on campus in the sun and listening to bob Marley this is wonderful|1
Representing Bob Marley on our own show day - @damianmarley we hope you have an awesome time tomorrow night! #philly http://t.co/GPjsLR5Wdx|1
Marco Rubio &amp; Bobby Jindal, both born to NON-citizen parents call for revising the 14th amnd. Republicans' brain is a nanometrology wonder.|-1
Bobby Jindal wants to bring his harm to the entire nation as president he will never be.  https://t.co/ZLp8lnS3ih|-1
Monday Wisdom from Bob Marley: "Some people feel the rain, others just get wet." Let's get those galoshes on, here comes the week!|1
Bobby Jindal and I may not agree on much but it was wonderful to have him join us on @OutnumberedFNC and I stumped him on Brady Bunch trivia|1
Bob Marley vs Funkstar de Luxe ~ Sun is Shining (Extended Club Mix)Gonna be a Hot One this weekend in the UK.  http://t.co/jdMEwEvWdw|1
"The sun shall not smite I by day, nor the moon by night"Bob Marley &amp; the Wailers NIGHT SHIFT *Live in NYC 4/30/76* https://t.co/6FN2LR019e|1
Happiness is a Sunday with freshly squeezed oj, hot black coffee and Bob Marley on the stereo. Happy Sunday, fellow humans|1
The super PAC backing Gov. Bobby Jindal, who was relegated to the second-tier debate panel on Thursday in Cleveland, will broadcast an ad|1
This SATURDAY! Live stream to Japan! Mad sounds and fashion! Rasta wear!! Big up to the late Bob Marley!|1
today is http://t.co/hLwDxCJdsN@OneLoveFestival  celebrating the anniversary of Bob Marley's One Love Peace Concert (22 Apr 1978)|1
"Sun Is Shining" by Bob Marley is now ripping it up on @RadioDanz http://t.co/PjzzD8qKs7 #np|1
Last chance for you to book in for our Bob Marley showtime tomorrow night! Fizz on arrival and a four course meal... http://t.co/UvkKTZI5ut|1
Personally thought Bobby Jindal won that debate, with Carly Fiorina as a close 2nd|1
Bob Marley - Sun is shining original https://t.co/3sGgyJIZFK Gorgeous day and very fortunate|1
Just under a mile up the road from us! Gotta love North Hills Friday night live music series! Bob Marley Tribute... http://t.co/R6WXZiSnli|1
The sun shall not smite I by day,Nor the moon by night;And everything that I doShall be upfull and right. - BOB MARLEY|1
The early kick off on Saturday is Everton vs Chelsea aka the John Stones Derby! BTTS written all over it?|1
@kraftcanada thanks Chelsea, I have all the info I need. Have a great Tuesday!|1
Chelsea score their 4th of the good flowing move. AFCB make all 3 subs #afcbcst|1
Made in Chelsea is definitely the best thing about a Monday|1
"We may not have it all together, but together we have it all" @ Chelsea, London https://t.co/qSt0poLynx|1
im about to go to bed and tomorrow night ill be at the chris brown concert. wow i love life.|1
Tomorrow night everybody gone be that Chris brown picture on ig that says I don't want to go there because school the next day lol|1
Get started early shopping for the holidays in Chelsea Oct 17 the perfect presents await!|1
Body On Me - Rita Ora (feat. Chris Brown) / May J Lee Choreography https://t.co/wl7HjVVz9b i think i pressed on the replay button too much|1
Friday in #Vancouver at the Scottish Cultural Centre see #GGW Champion Chelsea Green vs Malia Hosaka. Chelsea was... http://t.co/Pf0Czil2f2|1
@PhilWilliamsHQ Bobby Jindal may care about Planned Parenthood but he's a crappy La. Governor|-1
Worked yesterday then the Chris Brown concert, worked again today and got a full day tomorrow, too... Im ready for another cruise! #Vacation|1
Jesus! Chelsea vs Everton will the first game on Saturday. LOL. Hope I have a shoulder to lean on.|1
" religious liberty" is defined as religion that Bobby Jindal &amp; Huckabee approve of. Read the constitution! https://t.co/2yWw6mQGJb|-1
I'm sat alone watching made in chelsea LA and I'm happy with the man I've become|1
On August 3rd, Bobby Jindal cancelled his state's contract with Planned Parenthood.The people, under Satanic... http://t.co/VlvAPJ5Ueq|-1
That's a wrap for the weekend! Mika and Chris Brown finish in P6 (2nd in class) in the @AMOC_Racing Intermarque Championship|1
Bobby Jindal: 'I'm the only candidate that has actually reduced the size of government' http://t.co/S5Zdn5RaPq|1
@danielguest1 good man! Need your support on Saturday, those are the ones that will matter. Not a glamour tie with Chelsea!|1
Jose Mourinho may not be enjoying too much success with Chelsea in 2015-16, but has added a personal trophy... http://t.co/TUaKSzu7xu|1
@Chelsea_HQ I wish Chelsea sign Lucas Leiva and American national team player Jones in the January transfer window.|1
@nyannthierry  where should i meet you this saturday so that we watch chelsea vs everton|1
Can't wait for Sat watch the blues smash that Chelsea shite then I'll be smashing it @versatiliy @24KitchenStreet get down after game people|-1
If the weather holds out seeing The Handlebards in the Chelsea Physic Garden this Friday and Saturday should be fun! http://t.co/Q7tpmrbF60|1
chelsea just uploaded the CUTEST video of us from sunday omfg|1
Jindal, Landrieu appear on Face the Nation - Sunday on Face the Nation on CBS, Gov. Bobby Jindal delivered the sam... http://t.co/eqlb9jMQAe|1
#PhraseThatPays is back tomorrow morning at 7am with Ian and Chelsea! Make sure you are registered so you can win $500! 1049virginradio.ca|1
Lovely preview in the Kensinton &amp; Chelsea News for Amici's new show '35 Amici Drive' opens tomorrow at @LyricHammer http://t.co/21dMrkHgyJ|1
@RBKC Frock Me fair returns to Chelsea Old Town Hall this Sunday from 11am with lots of amazing #vintagefashion http://t.co/1U6DfklmqL|1
I'll watch made in chelsea tomorrow after college to make me happy|1
No blues starting for England! Sound for Saturday, Chelsea are getting fucked and Jose knows it|-1
@TiaaBrown_ I noticed that you love Chris Brown &amp; I saw that you gone meet him tomorrow so take pics like this! Lol https://t.co/MTOjeEfZkZ|1
Can't wait for Saturday- soccer am, Everton v Chelsea &amp; then the big one Liverpool v Utd  #bpl #lfc|1
Chelsea transfer news: Mourinho confident he will get John Stones ... http://t.co/diTkhOnsNu|1
@chelc0915 We'd be happy to help Chelsea! Please tell us more about what's going on so we may better assist. ^RoannaD|1
Chelsea could honestly be the 3rd Migo with me and gee, we all think alike|1
i had no idea august was gonna be at chris brown's concert tonight. i woulda went.|1
Binary's Women Crush Wednesdays are Chelsea &amp; Shannon! Come see their new works live at the prism TOMORROW! #wcw &lt;3 http://t.co/XHlylZO4VS|1
SACK! Jamal Wilson with a SACK of Chris Brown! 3rd down coming up|1
Just caught up with made in Chelsea hope jinky sort it out they would be great together, can't wait for next Monday #MadeInChelsea|1
Women's Super League: Chelsea close in on title with win against Notts County http://t.co/5dtTxBWBOS|1
If Chris brown hits the Quan tomorrow expect my ass to run and jump on stage|1
Bobby Jindal may be the 1st candidate ever to run for president for basically 5 yrs &amp; be at 0 % in the polls down from a round up 1%|-1
Does that make Bobby Jindal the 2nd candidate to be a parody of himself? http://t.co/8Jgxzk3Qol|-1
my siblings went to the Chris Brown concert tonight I'm already mad I didn't go plus August Alsina showed up.. they lost a sister tonight|1
Seeing Chris Brown, Kid Ink,Omarion,Fetty Wap,Young Thug,The Migos, August Alsina &amp; Lil Kim tonight was the BEST|1
Registered for @ELANQuebec's grantwriting wkshp in Chelsea, QC 18 Sept.! Anyone in Gatineau going to event? Need transpo. PV me. Thanks!|1
You're playing the same venue that Chris Brown did tomorrow how do you feel? @Calum5SOS|1
Chelsea &amp; I are making a list entitled "sh*t you hear on GT's campus" and we just heard our 1st item|1
Installing a full gas central heating system in the Chelsea area tomorrow. Looking for similar? http://t.co/r3nkIK8KXa|1
Shock of shocks, the posts about Bobby Jindal's birthright citizenship/"anchor baby" status are bullshit (http://t.co/YFv7FEr9Z2) ...|-1
Dear friends New York is calling and from 13th to 22 october I'll exhibit in Chelsea with the famous gallerist Nina Torres..I can't wait..|1
@889BrilaFM Chelsea poor form is attributed 2 Jose Mounrinh as he kept faith wid jst d 1st eleven widout putin confidence in his subs. #LHSC|-1
With Chelsea's poor start to the season it could be 3 points to the 'ammers on October 24th - and I'll be there to see it|-1
@Refinery29 re: the dude from 7th heaven &amp; woody Allen. Last time I checked, r kelly and Chris brown still #thriving|1
@UtdRantcast @br_uk do you think Chelsea deadline day bid was real or just spin by mufc to try and justify the fee? Think it may be latter|-1
3rd and 7 for #NotreDame and Chris Brown catches the 1st Down Pass|1
well Migos, Fetty Wap, Omarian, Kid Ink, August Alsina, Young Thug, and CHRIS BROWN put on quite the show last night|1
@EASPORTSFIFA #FIFA16 demo downloaded; 4-0 win in the first game with Chelsea against PSG @hazardeden10 1st goal &amp; @FALCAO man of the match|1
Bobby Jindal comes off as a White Supremacist with a sun tan.|-1
Savoring the last bits of summer before the big S starts tomorrow. #nyckids @ Chelsea Side Water Park https://t.co/TUbGMBZZLA|1
After a CP first down Chris Brown is sacked 2nd and 12 for the Mustangs|1
I am honored to say I drove Chelsea tonight may god bless @BallerJake|1
Quite the home debut for #NotreDame QB Malik Zaire, he just threw his 3rd TD of the day to Chris Brown. ND up 38-3 on #Texas #fox28 #NDvsTEX|1
My 2nd favorite in the Brazilian NT and sa Chelsea pd. Happy Birthday @oscar8 :D And sa uban pa naa sa lista  mehehe https://t.co/hiVCx6jMPs|1
@HiWireBrewing will you guys be open for the 7:45am Arsenal v Chelsea game on the 19th? I'll bring breakfast!|1
@NoLongerCrazy yes of cuz.. chris brown is working on his new album already and that's the 2nd single off the album after "liquor"|1
I'm going to Chris Brown at Isleta Amphitheater in Albuquerque, NM - Sep 12 http://t.co/pjNYeAsqN1|1
The fact that I get to see chris brown Thursday @HaleyHolcomb__  you jel|1
Saturday marked the 10th anniversary of Hurricane Katrina, and Louisiana Gov. Bobby Jindal says the state is now "stronger than ever."|1
Happy 6th birthday to Aubs! Chelsea kept the birthday breakfast in bed tradition going. Thats chels on the right... http://t.co/2Ntj0ng5Z3|1
The only good that comes out of a Monday is the fact Made in Chelsea is on|1
@MrsCollyO Happy birthday!! Have a top day. And hope Everton batter Chelsea on Saturday for you haha! x|1
@BBCSport some of these youngsters just go to Chelsea because ofthe money and know how unlikely it will be for them to get in the 1st team.|1
I'm waiting for Chris Brown to get a hold on this song also. It sounds like something he may actually remix.https://t.co/zVoBVDbZC2|1
@aziq_adam @IzzyJizzy99 ik :'( nvm tomorrow I Chris Brown her like she's rihanna|-1
Never mind about Conor McGregor it's wwe Battleground next Sunday night LIVE @FM104 @WardyFM104|-1
Still in search of the really Dayna Santullo. She's been missing since she willingly passed on a Chris Brown concert on Saturday|1
@jacobbelz dude! The coaches have been announced for the new TUF season starting September 9th. Conor McGregor for EU and Urijah Faber 4 USA|1
Conor McGregor backed up the talk and won interim gold with 2nd Round TKO. http://t.co/XAadtJ8IUV http://t.co/wP5juh3vQB|1
Chris brown is going to be in atx on Wednesday &amp; I'm so so sad I can't see my baby :/|1
Any funny business from Luke Neale at lunch tomorrow and he's getting chinned Conor McGregor style|1
Selling 1 ticket to Chris Brown this Thursday Sept 10!!!!! Let me know if you or anyone you know wants it!!|1
Did you know a Conor McGregor 2nd-Round KO was worth 5/1 odds? Read more at http://t.co/B6ogrErYlL #UFC189|1
Tomorrow is going to be a night full with @chrisbrown we got Kevin harts show, BET life of Chris brown on and Jimmy Kimmel body on me !!|1
I celebrated like Conor McGregor (into my pillow. Why frighten the neighbors?) https://t.co/0R1AfIXb2U|1
MMA: Conor McGregor recovers from a number of takedowns, stuns Chad Mendes with big left hand late 2nd round|1
Chris Brown really had me Saturday. He sung all the throwbacks|1
Chris Brown comes sept 15th and tickets are only $40. They're not great seats but still...Someone should go with me|1
Chris Brown is me when me and my girl on good terms and that dude in blue in the back is when we're not  https://t.co/fUiT0D2T4P|1
I tried to snap the Chris Brown concert Saturday but they didn't all post. They on IG though.|1
@hadyngreen you won! Conor McGregor knocks out Chad Mendes in 2nd round for interim title http://t.co/Glv4ASoIXR|1
Finally it's Sunday Funday! Whether you were out seeing Tim McGraw or watching Conor McGregor win the fight... http://t.co/83pta9TIDA|1
Couldn't get a link to stream the fight last night, can't wait until Monday night when its on 3e. Delighted Conor McGregor won though #UFC|1
So when is game &amp; Chris Brown homieGonna fight ??? Is it on pay per view or Friday night hood fights ??|1
Who wants to go see Chris Brown with me on Wednesday??? It's only 40 doll hairs|1
Conor, Conor McGregor - He may talk the talk but he sure does walk the walk, go on my son :) To Watch:... http://t.co/YxAJ2m0Gf7|1
Conor McGregor may have a big mouth, but he consistently backs up what he says when he fights, gotta respect that|1
All my friends actually want to go see Chris Brown this Saturday... Drink and have a good time... I think yes!!!!!!|1
#TEAMBREEZY make sure yall be tune in tomorrow to see @chrisbrown on @BET "The Bet Life of Chris Brown" http://t.co/VkOWwh08a0|1
I got the bronco game and Chris brown on Sunday lol|1
I love that: -today, I brought a Chris Brown album.-Thursday, I am going to a metal show.-Saturday, I am seeing One Direction. #music|1
I hope Mrs.tomasi know I won't be at the play practice Thursday because of the Chris brown concert . sorry not sorry .|1
Conor McGregor breathtaking! 2nd TKO over Chad Mendes, now let's see if Jose Aldo mans the f*** up and fights you.|1
@iamJulianT I love Chris Brown Sept 9 with jthrone|1
