If Apple is upgrading the camera on the iPhone 6s models, I seriously may upgrade...&amp; my phone isn't even 1yr old yet! #photographyproblems.|1
When will the iPhone 6 price drop? Immediately after the sep 9th announcement or not? and how much will it drop?|1
Today's the 9th? We've got some apple news coming, I just want to get on with it &amp; upgrade my iPhone.|1
@richdemuro would you PLEASE let us know when the iPhone 6s will be available for purchase? Hoping before the 17th of September. Thanks!!|1
Sundays vlog is processing, Monday's is exporting... You know for having to do it all on a iPad is say I'm doing pretty good.|1
To prepare for the #AppleEvent tomorrow I am reminiscing over legacy apple hardware including iPod 2nd Gen, iPhone 4, iPad 2. Get Pumped!|1
Accidentally left iPad sitting in the sun too long. Had to stash her in the freezer to cool down #whoops #straya|1
#Apple to unveil iPhone 6s, iPad today. For the first time they are releasing on Wednesday. All their earlier releases were on a Tuesday.|1
Christmas in September! Apple's keynote on the upcoming iPhone is today at 10am Pacific!|1
#castleberryisd 5th grade iPad Deployment going well! Students are excited! http://t.co/hcPY5IR8ZM|1
Happy Apple Fanboy Day! May the iPad be with you.|1
Today's iPhone 6S event: Start time, where to watch the live blog and how to stream http://t.co/TZUjjgbA5c|1
Who is as excited as I am about @APPLEOFFIClAL announcement tomorrow?  I haven't had a new iPhone since the 4S - I'm ready! #blogchat|1
@MarkVonVegas It's the best. I can't wait to christen my new patio on September 26 with some coffee and RedZone on ipad.|1
I still doubt Apple will announce new iPad at tomorrow's event. Apple might dedicate most of the keynote on new Apple TV.|-1
Anyone interested to find out about the new iPhone - livestream from 5pm UK time on any Apple device http://t.co/Otz5JQX9y2|1
Today my doctor diagnosed me with a repetitive strain injury known as "iPhone thumb". May my social media use be a cautionary tale to all.|-1
The new iPhone will be announced tonight at 1AM (10th Sept). Here's how to watch it live http://t.co/aFRlZFTPc5 http://t.co/JIhzZ3paAA|1
If your pupils can use an iPad better than you can then this course may well be ideal for you - http://t.co/8innWbrMqY|1
"Apple is expected to announce the iPhone 6S at 1PM tomorrow."Translation: At 1:00 PM tomorrow, the Internet will lose its shit.|1
Swanage - An Apple IPhone has been handed in @ Swanage Town Hall Office. Please come in and speak to us if you think it may be yours.|1
@pierce hahah. Excited for your live blog tomorrow. I know the rumors are strong but I remain dubious about the iPad pro being announced|1
@garrettc Do you think it knows that in a couple of hours it may be one step closer to obsolescence (and outpaced by a giant iPad at that)|1
#Apple to show the #iPhone6S, updates to the iPad, Apple TV and other products today http://t.co/2fSV8hScJa|1
1st gen iPad mini still going strong. Love that little guy.|1
Checks 2.0 will not be submitted tomorrow, but I'll end up taking the extra time for a watch app, NC widget, iPad optimization, etc.|1
New iPhone announcement tonight. If I don't get one ordered tomorrow with @ThreeUK for my upgrade there will probably be tears.|1
'unique mark patterns made by the oil of the fingertip on the glass of the iPhone screen when using different apps' https://t.co/9ol8o1Mand|1
Pausing on this day of my 31st year to yell at my ipad because pandora refuses to play the Carpenters' Superstar.|-1
@darebeark @alyaeldeeb12345 my memory  doesnt have more space. So i cant download it :( but i'll try to download it tomorrow from iPad|1
I believe the new Twitter update comes in time before tomorrow event. Might be seeing deeper integration with iPad Pro? SplitScreen!? #iOS|1
Apple is hosting its annual splash on Wednesday to unveil a new version of its best product, the iPhone #Africapkenya http://t.co/hL17VGWRnL|1
So tomorrow is the big Apple event. What do you think we'll see, iPad Pro? An iPad Stylus? Curious to see what they bring.|1
#Apple is expected to unveil 2 iPhones, an Apple TV &amp; a larger iPad. Watch the live stream tonight at 7pm here http://t.co/QwoJ0yway0 #tech|1
I expect to see news about a 32GB iPhone when I wake up tomorrow.|1
Will I be getting a new iPhone this year? No. But my two older kids will. So I'm kind of curious about today. http://t.co/8BESuqrn0S|1
The new iPhone is announced tomorrow. I already want it|1
Golf with the dudes, no work, pool day, and the new iPhone announcement.. Tomorrow shall be a good day.|1
Top 5 Gambling Apps for the iPad http://t.co/2JbwPxRzY8|1
Why spec Noritz? We want to know! Submit a vid before Oct 31 explaining why &amp; you could win an iPad! http://t.co/QNPOTCjrK1 #NoritzPro|1
@film_girl I'd buy the next iPad if they had Fassbender give the keynote tomorrow.|1
Can't wait to see the iPad Plus ....#Apple #AppleEvent #TimCook  https://t.co/qiR5JjDdjp|1
iPad Pro, Apple TV expected to take center stage Wednesday: It's that time of the year. For five years, Apple ... http://t.co/eHpn3KzylM|1
@TechJohnson I can't wait. I need a new phone! And since #Samsung has abandoned the UK market, I'll be ordering an iPhone this Friday|1
@LOHANTHONY my moms taking my iPad away tomorrow but it's worth it because I'm tweeting the KWEENT #ANTHONYCHAT|1
@martinlmnt like what else can they offer honestly? I may just get another iPhone because I'm used to the OS|1
Analyst suggests this may be the last big iPhone launch - with @jeremycontext http://t.co/vBPQ4CZRE6 via @pcr_online #AppleEvent|1
The 'numeracy map' just fits into an iPhone, bringing it alive, digitally! Search the AppStore, 1st level free. http://t.co/8HxVKGu8WI|1
The Accounting Career Fair is this Friday! Be sure to engage with us by using #kubusfair--you might win an iPad mini!|1
Started the day listening to @theweeknd, new iPhone reveal later and the #NFL is back tomorrow. Happy hump day!|1
So iPhone 6th generation has 3 models: 6, 6 Plus and 6S. If I can wait it out I'll get the 7.|1
Also, the iPhone 6S, 6S Plus and the new iPad will be coming out tomorrow morning! Will be checking out the highlights.|1
iPhone 6s: Everything you need to know!: Apple's event of the year, which is being held on September 9, has ma... http://t.co/LrIJS2reRb|1
New IPhone, it's a relegious day. https://t.co/ug29uE6zy1|1
Giant iPad anyone? Don't forget to check out the Apple Event at 1pm EST. #apple #charlottehttp://t.co/uOVQhibSJ2 http://t.co/GVhKOJPUIJ|1
I truthfully liked my galaxy better as a phone experience but the game/app market is better on iPhone.  https://t.co/Juxz9dU2Sv|1
Business Insider: RUMOUR: Siri may always be ready to respond to your voice on the next iPhone (AAPL): Apple t... http://t.co/NtqPBIlAby|1
@talk2GLOBE hi, may i ask what are the requirements needed for the iphone 5s under plan 999?|1
May the Force (touch) be with you, Apple. Unleash that monster iPad. Come on! #AppleEvent|1
11 hours until Apple announces the iPhone 6S, here's what to expect: http://t.co/K1hTCDm6fI|1
Prediction: I will have a status saying that I'll be buying the new iPhone by tomorrow morning. I've done that... http://t.co/bBoCXousDy|1
Tech Tuesday: Apple launches new iPhone with 'Force Touch' http://t.co/jRUi50Nt7J #newiphone|1
7,000 seats for an Apple product announcement? iPhone is just upgrade. Apple/Siri TV may be big. I wonder who's playing? TayTay? Billy J.?|-1
Did you know you can split the keyboard on your iPad? I didn't. Here are some Ninja tricks for the iPad you may... http://t.co/RpzAoPo5vR|1
If this new iPhone sounds like it'll suck after tomorrow's announcement then the joke's on me for saving up to get it.|-1
Who is ready for the iPad Pro? Today may be the day...|1
I'm so excited for the new iphone release tomorrow yas.|1
I really hope Apple weighs a cup of nuts on the iPhone 6S (9th Generation iPhone)|1
SO excited for the #Apple keynote tomorrow, I need a rose gold iPhone 6s plus in my life. AND They're rumoured to announce the new iPad YAY|1
My dad just dramatically got upset at me for no reason but I was getting an iPad tomorrow so now what|1
Looking forward to the #AppleEvent today. It will make for interesting 4th Quarter results w/ an upgrade to the iPhone, iPad, and Apple TV|1
New iPhones, iPad Pro, and Apple TV on the way today at 10 A.M. (PDT)! #AppleEvent http://t.co/WLFT7hrxH8|1
Can't wait to see the new iPhone tomorrow. And final can update my apple watch to OS2|1
But with a new iPad coming out, I may be able to snag an older iPad at a decent price.|1
I wish I still had my iPod from ages ago. I had much better taste in music in the 8th grade|1
Still head over heels in love with my (4th generation) iPod. Curated to the hilt. #ipod #Apple #oldtech #personalmediadevices|1
IPod: Apple iPod touch 8 GB (2nd Generation--with iPhone OS 3.1 Software Installed) [OLD MODEL] http://t.co/XaziaJHfPb|1
I used to absolutely love the music to Silent Hill. Even had it on my ipod! https://t.co/2UZ23Nn4kX|1
My first Ipod was a 3rd Gen, everyone else had iPhone 4s at the time.|1
[#NEW] Video: Casey Veggies Talks First Meeting With Jay-Z At 17 Years Old, Working Hard to Inspire the Youth http://t.co/3ETpyD7C9o Dec 15,|1
I crushed a 7.5km run with a pace of 4'45" with Nike + iPod.  #makeitcount  #nikeplus #september : http://t.co/vOYVLSkvGV|1
off on holiday tomorrow, downloading apps for ipod for the plane anyone know any good free ones?|1
When I do auto time on my iPod it thinks it January 24 1971|-1
I should be getting into bed, I am however instead looking through my iPod for songs I might want to pole to.  I may be addicted.|1
Minutes aways for the unvieling of iphone6splus or is it going to be Iphone 7??????!?!?!?!?http://t.co/fRltFMjkCK|1
Get the popcorn (or coffee in my case) ready, folks. 1 hour till the new iPhone event! Tuning in from #Asheville, NC.http://t.co/sTI3xeHGhV|1
Apple has a recall on all 1st generation iPod Nano's, And will give you a 6th generation iPod Nano if you return the 1st generation one.|1
@markiplier I have faith that tonight I may win an iPod which would mean the world to me and I would treasure it qith my life|1
#EGGPLANT LETS GO new winner of the iPod and may we reach out goal Hazzah and Mark are you going to pax south|1
9 September has arrived, which means Apple's newiPhone is now just hours away from becoming an official thing. http://t.co/t6BgVRns0Z|1
Hey @UKRunChat please RT, running GNR on Sunday, anyone got suggestions for good running songs.  Need to update the iPod.|1
i went through my old iPod nano and I still listen to the same music I did in 5th grade..chili peppers, green day, the killers, blink omfg|1
If you found a set of headphones &amp; an iPod @flystl on Saturday by @Starbucks in Terminal C, please turn them in. Reward offered. #american|1
Another nail in the coffin to Jay-z failure 'Tidal' as Cash Money sues for $50m over Lil Wanker's album @MarkDice http://t.co/iFpOECcl7a|-1
the new iPhone gets announced today... that's really all that matters, happy wednesday every1|1
@jramstrash i have a 4th generation ipod and i cant download any new apps or update anything so i pretty much just use it for music/snapchat|-1
Lmao just turned on my ipod for 1st time in 4evs &amp; this is the last photo http://t.co/NQhJAxq8EI|1
it's your last chance to take advantage of Gazelle's best price guarantee on iPhone trade-ins... http://t.co/WLycePxNjc|1
https://t.co/kecj06sddV  come join mark on his charity live stream to help fight Depression and Bipolar  ^-^ you may even an ipod#eggplant|1
Saw an iPod nano 5th(?) Gen 16GB one at the cash converter's place|1
Hey @markiplier my birthday is this coming Thursday and I don't necessarily want an Ipod but a happy birthday would suffice haha #EGGPLANT|1
1st song on the iPod upon leaving GB is 'Good Life' by One Republic &amp; upon leaving an amazing weekend w/ @Amy__Bailey &amp; her fam it truly is!|1
@amitbhawani @geekyranjit  ...what are your thoughts about Apple's iPod touch 6th gen?|1
We think it's much better than kids who  obsess over people like Jay-Z &amp; Miley Cyrus. https://t.co/BTujbNU8sD|-1
#ipod: iPod nano may be the worst ATM skimmer ever created - Just when you thought the click wheel... http://t.co/3vMcsrvTXC #iPOD-NANO|-1
If you're an iPhone user like myself, new phone and more to be revealed in the next 20 minutes! Watch it live here http://t.co/FzBHq5Xx9I|1
@MARC_RYDER Yeah bro but it's warning shot. You can't go all in on the 1st track. Jay-z made that mistake and Nas FINISHED him.|-1
My boys @SharifAfifi &amp; @WillBradnam just came on shuffle on my iPod and now I MISS MULLED WINE NIGHTS AND THE 8TH FOLD AND THEM.|1
Few more hours to iPhone 6s launch and im still using the 4th generation ^_^|1
I'm eligible for an upgrade next Monday. Hopefully the new iPhone drops next Friday so I can go straight to Verizon after work.|1
Jay-Z stole his whole 2nd verse from "99 Problems" from Bun B in the UGK song "Touched". Come on y'all listen to old hip hop.|-1
BTW, @LeeIngram4 is the guy who gave me an iPod last year, on which my son (@PChangerP ) 1st set me up on Twitter. My 1st tweet was 9/6/14.|1
.@JB17Official has become the 1st footballer @RocNation Sports,owned by legendary rapper Jay-Z #topfootballfacts http://t.co/hwUOI7PszL|1
Found my old iPod from like 7th grade and am now realizing I listened to some hood tunes for just a kid!!|1
Don't forget to collect the bills and win free ipod nano 7th generation &amp; 17% CK vouchers of total bills , we... http://t.co/CNn4Ln9swy|1
I have loads to tell you guys that will make yall super proud but I'm using my iPod now and it's super laggy so I'll tell later or tomorrow|-1
#FF @innocent - not just for the drinks but for Jay-Z's 99 problems! 99 problems that we may just ponder about at some point in our lives!|1
Rumor has it Apple is likely to unveil 3 new iPhones at their 9 Sep media event; iPhone 6s, iPhone 6s Plus,iPhone 6c http://t.co/QF8d6P1Y7R|1
still can't get my IPOD 3rd gen shuffle to change songs cos of the USB NOT RECOGNIZED ERROR 43 shit. Does this mean I need new USB CABLE?|-1
@frecklequeen45 I *may* have a playlist on my iPod devoted entirely to songs about trains. I *may* also be a total geek.|1
#apple A look at the evolution of Apple's iPhone: Apple will unveil the new iPhone on Wednesday. The next iPho... http://t.co/TEDe4E4fuA|1
For those who may not know, Jay-Z wrote the verses for Still D.R.E but he's never disrespected Dre or ever spoken about ghostwriting.|1
You're all talking about an iPhone event and I'm just sat here chatting about Tinder http://t.co/qBhOUGEjBM http://t.co/IBM9lJIoCI|-1
December 4th only cause I used the beginning in my Jay-Z speech for class https://t.co/5bw2R2xGvo|1
I hope tho hive will be fast to upload the video and audio of the performance tomorrow so I can have it on my ipod|1
@jroberts332 @jobot935 [2/2] That's why my Prog/Indie/Heavy Rock-filled iPod has One Direction's 3rd and 4th albums on it.I am Not kidding.|1
Gonna try to run 6 laps tomorrow atleast 5 it should be easy I just can't talk to ppl. Just gotta listen to my iPod and keep runnin|1
@normwood I still have my original newfangled iPod. Maybe I'll bring it to the game on Monday.|1
Meek drooped like a Jay-z album the 2nd &amp; 3rd time you hear it. You will understand it and Fall in love with it|1
Meek Mill or 12 year old white boy that just discovered Jay-Z? The world may never know|1
Mom tells me to not spend so much time on my iPod but when I ask her to take me to 2nd &amp; Charles to buy me books she says no...wut|1
Does anyone know how to get around a disabled 5th gen ipod WITHOUT putting it into recovery mode?|-1
Cool filter called the blinding sun &amp; iPhone 5c... Lol @ Gediminas' Tower https://t.co/8aAtHasK7j|1
Well, I'll be watching on a 4th gen of iphone. even it wont get ios 9 update.  #AppleEvent|1
Found an ancient ipod nano, I may have to keep it.|1
I'm not taking my iPod to school tomorrow because I want to have a battery when I go to my concert|1
1 gud thing about losing my phone is that it made me use my iPod which has all the songs I used listen to in 3rd year|1
'Sometimes you're just better off dead, there's a gun in your hand that's pointing to your head...' Wednesday's iPod selection|1
1st day back at work after a terrible week off and I've forgotten my ipod, security pass and lunch! #mondaydaze #cancelmonday|1
Dear ppl who attribute vocal fry trend to Britney &amp; Kim K: have you ever heard Jay-Z talk? https://t.co/5kbwMWMcII https://t.co/TGIIFPwJwr|-1
@bretteldredge can next Friday please get here any faster? I need the rest of #Illinois on my iPod!|1
Sitting at a curb staring at the White House Listening to jay-z.thats a fine Friday|1
I drenched the old iPod nano (6th gen) in isopropanol and it actually worked! The screen will never look the same but totally worth it.|1
I'm so excited to see the new iPhone release, even though it may be following a trend xD|1
"The iPhone 6S, the greatest thing to ever exist since the iPhone 6." *CROWD GOES WILD* @RashidMattar  https://t.co/RqTn6EiI8l|1
I found my old ipod classic from the 5th grade the songs on it oh my god|1
same stage as Jay-Z but y'all don't wanna give props. Cool. Need I speak on @iamjtown 's achievements? The 1st emcee to represent GH @ the|1
If Jeb Bush wins by some far chance the flood gate will be really opened and our 1st language will be spanish|-1
When you realize classes start the 9th so the AC/DC concert will be the best concert since Eminem and Jay-Z #thatwasgoat|1
WASHINGTON (Reuters) - Jeb Bush said on Thursday he would back fellow Republican presidential hopeful Donald T... http://t.co/RtNErbQL59|1
haha Jeb Bush is such a bore the guy in the background of this vid could totally not give a shit about this dirtbag. https://t.co/lQ57BgGTFg|-1
Make a lasting impression on the first day of class tomorrow: walk in with a boom box blaring Public Service Announcement by Jay-Z|1
OMG A Trump supporter on #CNN just suggested that Jeb Bush may have low testosterone which is why he's low energy.|-1
Jay-Z make time for Bey.. The President make time for the 1st lady. So where are you so busy at again?|1
Time for the #media to begin asking Jeb Bush some tough questions. #law #GOP #media #journalism @bpolitics  https://t.co/EYz8pECjwd|-1
Jay-Z and Beyonce came to Taylor's 25th but not Kim and Kanye's wedding. Imma let Taylor finish, but she had the best birthday of all time.|1
@tomwarren I don't know. She just recited Jay-Z to me. This may have yours beat for best reply. http://t.co/uLSBcnt92v|1
Jay-Z: Can I get a Fuck You?Jay-Z's Dad: I don't know, CAN you?Jay-Z: MAY I get a Fuck You?Jay-Z's Dad: No, it's supper time. Go wash up.|-1
Talib, Jay-Z, Kanye, T.I, Big Pooh, Dela, J Dilla, Nas, Pete Rock, 9th Wonder and the legendary Slum Village.|1
@marklevinshow presented summation of costs that may be associated w/ building "wall" on the southern border. WAY less than Jeb Bush stated|-1
Personally handing Jay-Z jerseys may be the highlight of my New York existence. First time I've been star struck.|1
Jay-Z may have his big companies... And Beyonce but that doesn't amount  to what Nas has done for the world and the people.|-1
"See baby photos of Blue Ivy Carter, the daughter of Beyonce and Jay-Z," - Huffington Post https://t.co/i8uyzsulTu|1
.@StephenAtHome  #baddecisionsYou make me not want to watch your show(s) by having Jeb BUSH as 1st show guest@CBS @JulieChen #NOCOLBERT|-1
If you pine for a time when Jay-Z didn't suck, then listen to Czarface. Esoteric, 1/3rd of the group, is a dead ringer for his voice.|-1
Turns out that annointing Jeb Bush the default establishment candidate may have been premature? you don't say. http://t.co/XVeQXKX6Va|-1
Both Jeb Bush and Lindsey Graham want to be the 1st "Matronly" POTUS!|-1
I know it's old, but The Beatles, Jay-Z, Danger Mouse -- c'mon... Classic mix --... http://t.co/Q0ZwccX6Vi|1
The day Jay-z comes to S.A I'll be the 1st person to cue  at the computicket  I love that man|1
#people #celebrity Tidal is a Satanic Illuminati Plan to make more $$$ Jay-Z, Beyonce, ... http://t.co/TVxyB2kdXt http://t.co/F8s7OkbjFm|-1
Song Cry x Jay-Z is one of my favorite songs, don't screw over the one that's been dsd1 no matter what changes life may bring, just don't.|1
@SeaGlass4Nicole Today was a Jay-Z type of the day. Who knows what tomorrow will bring?|1
What I don't get is why donors would fill Jeb Bush's coffers!  There is a frightening division in the Republican Party that may end in loss!|-1
@insanityreport @rodimusprime there's no middle ground with her though. Her Jay-z insights used to veer off into the 3rd testicle range|-1
Jeb Bush: "If you create encryption, it makes it harder for the American government to do its job" http://t.co/onKeBxVfrc|-1
I don't know much about algebaaaa,but I know today it's the 4th and it happens to be Jay-Z's wife's BDay.|1
Aye now Meek may surprise us. You know when Jay-Z dropped Takeover they thought it was over for Nas. And then Ether......|1
.@jimmyfallon I think you should get .@taylorswift13 as guest against Colberts 1st show. He starts with Jeb Bush really?#baddecisions|-1
"We make a million of beats, cause our stories is deep. And fuck tomorrow, as long as the night before was sweet." - Jay-Z|1
@OANN 1/2  I can't believe I'm defending Jeb Bush but here goes... 1st: No official language here in the United States of America.|1
May the Lord give you Jay-Z and Beyonce's kinda love... No way that relationship is fake or for social media|1
@jimmykimmel Bring the HEAT. Get TOP draw guests against Colbert 1st week.1st guest on Colbert = Jeb Bush - really? awful|-1
@realDonaldTrump We need to terminate this horrible deal with Iran on the very 1st day in office, but JEB BUSH REFUSES! End of discussion ..|-1
St James Park randomly playing the instrumental for My 1st Song by Jay-Z at half time?Decent.|1
@AndreaTantaros  Jeb Bush appears to be afraid of something.  Probably the truth and Trump may be able to help him out.|-1
May the best of your today be the worse off your tomorrow- Jay-Z|1
An i will bring my ass to NEW YORK IF I HAVE TO..  We going to sat that bitch off... Jay-z yall lost your fucking... http://t.co/iquQxxqxRI|-1
Jeb Bush also took in some hard cash in the Hamptons on Saturday https://t.co/aDFNIPzue6 via @prwatch|1
Dreamed I was @Beyonce and I spent the night making out with Jay-Z at a Lower East Side rooftop party until the sun came up.|1
When Jay-Z said, "Thirty-eight revolve like the sun round the Earth" http://t.co/WxW2bOLCEl|1
@daveweigel Jeb Bush probably knows and he'd probably get us into a 3rd Iraq invasion.  Knows lots of little facts, learns nothing.|-1
Roadblock: In the immortal words of Jay-Z: "Whatever deity may guide my life, dear lord don't let me die tonight.... http://t.co/mnDysX2NKb|1
#DALE: Get set to battle it out! @JoRuffin88 is dropping the beat for a Kanye Vs. Jay-Z ride tomorrow at 630pm! Grab a bike!|1
Jeb Bush's ad blitz begins Sept 15th in the early primary states. http://t.co/hKBjJ3fTcV No poll movement by October? Donors might squirm.|-1
c'mon. you GOTTA love this guy!@dailykos Donald Trump says Jeb Bush should 'set the example' by speaking English only|-1
The game 1st album 1 song he say he rap like Eazy-E then Nas then 50 cent then dr Dre then Jay-Z then Eazy-E again then like his dead bro|1
My following may not be as big as Jay-Z's but I got a solid supportive growing following. Thanks for the love. #TeamM00Y0U|1
@realDonaldTrump @JebBush Jeb Bush dug himself a deep hole with his "Act of Love" comment.If he was +3% yesterday, he will be -3% tomorrow|-1
When Jeb Bush stepped up onto the fabled soapbox at the Iowa State Fair on Friday, fairgoers pelted him with questions about the legacy of|-1
.@Olivianuzzi Eric Cantor, who evidently wants Jeb Bush to lose the nomination, will endorse Jeb Bush on Thursday http://t.co/JoVLVrgPI2|-1
Jeb Bush pretending he's a co front runner but he's in 4th place and Carly Fioriana bragging how she's in 2nd place in 2 states. Losers.|-1
Jay-Z stole Bigs actual words damn near da 1st 8 bars on "I just wanna love you" (give it to me)  https://t.co/xss5q3AlZy|-1
John Kasich may is just Jeb Bush from the a different state. He's a mealy mouthed squish.  https://t.co/cDllS7Il9E|-1
Jeb Bush may have got himself into a bit of a mess.The presidential candidate, who will appear on the first ... http://t.co/jeL8ky8CMC|-1
I grew up to this song..didn't knew the 2nd verse is about beyonce..until now.JAY-Z - Lost One ft. Chrisette Michele http://t.co/LYgSbix0Wp|1
@JKailli Although you may know this better than I do since you're from California lol I'm not knocking Jay-Z view in black culture, I say|1
Politico reports 3 top Jeb Bush fundraisers left his presidential campaign Friday, amid questions about the strength of his candidacy. Wow!|-1
August 5th is Work Like a Dog Day. Because sometimes you just have to do what you have to do. Jay-Z said it well: can't knock the hustle!...|1
Donald Trump: Jeb Bush should be 'speaking English while in the United States': Donald Trump on Wednesday fire... http://t.co/8x9Io52qEE|-1
@realDonaldTrump When was the last time a front runner was asked about a 3rd party run? The media should be asking Jeb Bush that question!|-1
"The best part of living in New York is the nightlife. The 2nd best part is knowing that Jay-Z and Beyonce share the same weather as me."|1
@AvanhVan The one that shows Jeb Bush IN 11th Pl. yet talk about Jeb Bush every morning instead of the others ahead of him- OK ?|-1
the 1st dance at my wedding will actually just be a duet of Diamonds From Sierra Leone-Remix with my husband as Jay-Z and myself as Kanye.|1
@TheFive C'mon @Greggutfeld! If anybody needs your harsh advice , it would be your friend Jeb Bush! @donaldtrump does a heck of a lot better|-1
