Samsung Unpacked 13 August: Where to watch live stream of Galaxy Note 5 launch: How to watch the live video st... http://t.co/wFlS65QXsA|1
Get back on the 16th, and have 25 days or so until move-in day at Northwestern, which I hope is enough time to binge watch Game of Thrones|1
Meet the South African who put 'Game of Thrones' on the map &gt; in #SundayTimes Lifestyle tomorrow|1
I've made it a goal to get caught up with Game of Thrones by the 27th and I'm near the end of season 2. Let's do this http://t.co/puOQLFpACW|1
Thanks again for the amazing gift @Mattew , I can't wait to watch all the 2nd season again of Game of Thrones!... http://t.co/r4mtcAIHIq|1
@HunterGBaseball @Dan_OMara To whom it may concern I ate a bunch of cashew ice cream while watching Game of Thrones.|1
Watching the 1st series of Game of Thrones is bringing back painful memories|1
The emotional rollercoaster that is watching the entire 5th season of Game of Thrones in a single day has come to an end.|1
It's sunday so you know what that means. Taking over .@OriginPC with episode 5 of Game of Thrones come on down http://t.co/RWJQYjPnYu|1
This may be true, and it means that Google is not accounting for local culture in driving patterns, a #ux fail https://t.co/MPBEloQ1Rs|-1
If anyone is interested, I have a pizza in the oven and the boxed set of Game Of Thrones on blu-ray #Friday #TurnDownForWhat|1
C'mon @mountroyal4u. Some signage? Some way finding signs? Anything? How about tell Google where your various bldgs are?|1
I'm so frustrated with Game of Thrones and I'm only on the 10th episode|-1
The 1st season of Game Of Thrones is so amazing! Re watching it again.|1
Like Nathalie Emmanuel is bothered she's not been asked to Hollyoaks 20th anniversary when she's now in Game of Thrones|1
Another new episode of Dragon Ball Super. Thank you Sunday's, you have given me hope until Game Of Thrones comes back in my life|1
Saturday morning domestic bliss is wife teaching 14y son how to play the theme song of Game of Thrones on the piano|1
3 more seasons of Game of Thrones? C'mon! You can at least make 10 seasons...right? Is that too much to ask? Ok, 3 is fine.|1
@LunarPandorium Got through two episodes of the Game of Thrones one just now. May play more of it later.|1
Peter Dinklage talks Game of Thrones season six, and how he let his hair down ... - Herald Sun http://t.co/CYWBrueUM9|1
Thank you to all the awesome people who supported the cast tonight! Game Of Thrones is amazing! Might have a suprise game tomorrow.|1
@soccercanales If JK was on Game of Thrones, his name would be: Jurgen Klinsmann, Master of the 6th Substitution of the Friendly Clan|1
I'll be out of town on vacation till wednesday so I won't be on the stream tonight. Once I'm back it is time for more Game of Thrones!|1
One of my favorite characters on Game Of Thrones just died I can't go to school tomorrow I'm grieving|1
Remember when Game Of Thrones was on TV in SA the same time as in America? Forget the poverty we were a 1st world country for those 10 weeks|1
Nothing like starting your Saturday with marathoning "Game Of Thrones" until you finish the entire series on HBO GO.|1
I am watching the Hardhome episode of Game of Thrones for the 5th time and I vote|1
@erin_yvette Hey Erin, when do you think Telltale is going release the 6th Episode of Game of Thrones? I really love that game.|1
The worst thing about going back to school tomorrow is not being able to watch Game of Thrones all day.|1
Google did great with YouTube purchase. It is now &gt; $40BN. http://t.co/ZpxFSHxQ8S. I bet Facebook did equally if not better with Oculus.|1
Why do I have to go to class tomorrow, isn't college just watching Game of Thrones??|1
Why do Monday, when you can do a glorified Sunday!? Breakfast in bed with Game of Thrones. Done.|1
Samsung confirms August 13 launch date for the Galaxy Note 5 http://t.co/6j6BlmnEg6|1
Ned Stark may be back for "Game of Thrones" Season 6. Here's what it means: http://t.co/jdHFOBM5ol via @HuffPostEnt  #GameofThrones|1
@Nowacking I though you may want that you and the rest of the @Elite3Official crew sweet talked me into buying Game Of Thrones.  I'm hooked.|1
@Shake4ndBake will probably give it another try in the future. I wasn't into Game of Thrones at 1st try, but I kept watching &amp; it grew on me|1
@EephusBlue - C'mon, stick around. It'll about to get "Game of Thrones" level bloody on here.|1
or just start watching Game of Thrones and be like, "i'll finish it tomorrow before 2"|1
I honestly think this is the 8th time I've tried to get through the pilot episode of Game of Thrones #mustpushthrough|1
@HatePash1 He's the 2nd Daario from Game Of Thrones who's more charming than the original: https://t.co/4ZPoq6ZDFA|1
Friday night: Mom bringing home a taco for me while I watch Game of Thrones with my dog.|1
I move in tomorrow and I'm not done packing but like...Maybe I'll just binge watch Game of Thrones...|1
Yes I backup with Google and Dropbox.  https://t.co/PJQXXF7UtU|1
Visual effects work done with "Image Engine" for the 5th season of Game of Thrones http://t.co/b5YjXA0Sne|1
Its okay if its almost 5am and ive had no sleep in like three days cos im on the 4th season of Game of Thrones so who's the real winner here|1
May be it's time to say good bye to Galaxy Note edge ;) http://t.co/1V313yMO78|-1
@ARSENALGIRL1971 just show them the last episode of Game Of Thrones , on 2nd thoughts , Don't !  lol|1
@alyssa_d_ewing my Friday night is spent watching Game Of Thrones with dad... Haha|1
@talinaroma Harry Potter, Percy Jackson, Thursday Next, Game of Thrones, or Pillars of the Earth are mine. #SS15|1
Even NFL players have strong feelings when it comes to Game of Thrones spoilers, but it may not be what you mi... http://t.co/A8im4JWdFv|1
Early start tomorrow so off to bed with a mug of peanut hottie and late to the party but finally going to start watching Game Of Thrones!|1
@McNamara247 Definitely possible! I do it all the time with Game of Thrones. I may even like the series better (hides)!|1
@wmap heard great things about the audio versions of Game of Thrones (although the preferred reader did not read the 4th book)|1
Adblock Browser for Android now available on Google Play (but it might not be for    September 9, 2015http://t.co/h2qKe82wq3 Cool Tech!!!|1
I've cried less over my last breakup than i've cried over the 10th season of Game of Thrones. @GameOfThrones|1
I saw this during the 1st season of Game of Thrones, so it's not technically their 1st kiss #bb17|1
Game of Thrones season 4  premieres on April 6 on HBO. Are you ready? Watch the trailer and cool 9 m http://t.co/J2HVAZWklV|1
Switching it up with some TellTale Tuesday tonight- Walking Dead, Game of Thrones, or Wolf Among Us?|1
@ddale8 it may be awesome like the wall in Game of Thrones :)|1
@ Lomeli12_ C'mon man. Google. https://t.co/TVdvPhiWhp (I think about to connect to decode" @ kyhwana I feel silly. I just about 13% bet...|1
I'm sitting down on my 10th hour of Game Of Thrones eatin girl scout cookies, does it look or even sound like I care what your thoughts are?|1
Everytime I reread/re watch Game of Thrones, Ned Starks death at the end of the 1st book/season is the most depressing. #GoT|1
I just spoke with my mom on the phone for 30 minutes. She finished the 4th season of Game of Thrones. Very exciting.|1
I may or may not have put a song from the Game of Thrones soundtrack on the playlist for the yoga class I'm teaching tonight.|1
We may have just reached peak Sisi - "Egyptian state TV uses the Game of Thrones song to show off the new Suez Canal" http://t.co/PCX7SZWzFL|1
Really tired! Great day! Going to put my feet up and watch Game Of Thrones maybe Agents Of Shield. Night! Cya tomorrow!|1
Day off tomorrow, going to use it to be very productive and by productive I mean watch a lot of Game of Thrones|1
@MarkKreidler I'm one of the few who agree with you about Game of Thrones. I also tried the 1st season and gave up. Dark doom and gloom.|-1
I'm now entering my 4th day without watching Game of Thrones, my symptoms are getting worse...... http://t.co/Kyjf6NKcud|1
Thanks to everyone who came over and played the Game of Thrones with us today. See you tomorrow! #PlayTheGame #NursingORGWhy #WeILLUMINATE|1
'Game of Thrones' just cast a character who may have a huge role next season #GameOfThrones #GOT #GOTonUBOx #UBox http://t.co/Mz02BcHJUX|1
[1/2].@BrianRathbone: In case you haven't already grabbed it. May I offer you a free fantasy ebook?  Amazon http://t.co/YTmyqLf2U3  Google|1
I'm just going to have to delete all social media in the time between the releases of the 6th series and the 6th book of Game of Thrones|1
Game of Thrones season 5 for free may seem too good to be true, but that's only cause it is. My day went back to being terrible.|1
So, as someone who just got the Game of Thrones 2nd ed LCG, what websites should I be going to for decklists, discussions, etc.?|1
The Hound from Game of Thrones is making a Lemon and Pistachio cake on Sunday Brunch, bloody fantastic start to the day.|1
@normanisnachos I may or may not have searched it up on google|1
This looks interesting...and you can sign in with your Google account  SAT Practice on Khan Academy https://t.co/qo3B1ULAT5 via @khanacademy|1
Using this tomorrow! Practical Ed Tech Tip of the Week - Create a Random Name Selector in Google Sheets: http://t.co/sagY8OyDqc via @rmbyrne|1
The Google+ for Business Workshop 18 August is SOLD OUT! Don`t worry you can book into the 10 September Workshop Now! http://t.co/9ApHf1bGJ9|1
Are you a virtual assistant? On Google+? Member of the Virtual Assistants Community on G+? C'mon .. join us! http://t.co/MuOXlhSo3t|1
Few people understand names - google+ may have failed because of it.  http://t.co/dkKtuvaQiU @adamshostack http://t.co/Z65Gp2paAI|-1
Photo: Understanding the Basics of Google Plus You may have heard people speaking about Google+. It is in... http://t.co/AaDcR0F8pZ|1
Happy Friday everybody!  Does anybody else have a GOOGLE+ page?  Let's connect if you have one!!!  ;)... http://t.co/Vrqp9u1P8D|1
Learn the basics  of Google Adwords: Do You Want More Clients - The Next Step. Bristol - 19 September. https://t.co/HO8ni04XxQ|1
Google+ is still spamming me. One wonders when they may concede defeat and pull the plug.|-1
Thanks for all the great Google+ reviews so far!! Remember to write yours by September 22nd to be eligible to WIN... http://t.co/knkGmvY9sI|1
What do you think about Google possibly buying Twitter? Especially after the collapse of Google+? http://t.co/6tlex2yhCO #socialmedia|-1
I should've just shared it on Google+ :/But this was what never reached you Friday night, @JoshuaDtown. Congrats!!! http://t.co/lMJGRpWOe5|1
@chaddockr @LexStarwalker Your conversation on race/species in the #CypherSystem gave me much to think about. I may make a post on Google+.|1
@iFicS Honestly- do you actually remember a @YouTube update that DIDN'T make things worse? Well, the upcoming google+ decouple may count.|-1
(Part I) Dead Network Walking: Why Google+ May Be On its Way Out: Google is phasing out many of the capabiliti... http://t.co/OpEmKrR0gP|-1
Google+ sending me an email with "A few posts you may have missed"...bless|-1
I've a livestream on Google+ this Saturday, if you're interested,  Tweet below.|1
Hanging out for the SummerInterested in more Google+ Office Hour Hangouts? We know you June 13, 2012 http://t.co/4zuCcd0DGq Cool Tech!!!|1
I may dislike like facebook, but I fucking hate Google+ with an unholy passion. What an ugly unintuitive interface.|-1
Get Your Business on the 1st Page of Google / DIY-SEO, Tuesday, September 15th  #constantcontact http://t.co/zQBCAs7Vxb|1
Did you get a chance to join our Google+ Hangout Friday, July 24th? Take a few minutes to watch the live broadcast! http://t.co/AcGBNlDnGi|1
If you are interested in my next Google+ for Business workshop 10 September Derby,Direct Message me for details and a chat #lichfieldlocal|1
@MrMandolino XD my brain may be a little wounded from translating google translate. or a lack of nourishment... one or the other 8D|-1
I think Google may be worried that if they allow people just to add sites on Google Now, then people will use it like Google Reader.|-1
Mail over 'a few Google+ posts you may like'. It's alive!|1
Listening to some Grateful Dead on the YouTubes. It's giving my Friday afternoon a great vibe.|1
@ironbite4 @christinelove I'm going to give you two answers, and you may decide which one is accurate.1. On Google+2. In a sex dungeon|1
GOOGLE - CERN will open the BOTTOMLESS PIT of Prophecy Sep 23RD? - http://t.co/AF7RIWvgUY http://t.co/PhPOQ1F0a0|1
@BriceLeonard They're working fine on my part. It may have to do with the weening off of Google+|-1
If they ban all p0rn in India, Chrome's Incognito window may be the next thing to die after Google+.|-1
4th row: Google+ dead or soon about to surpass Facebook in active users? http://t.co/pSvmflU9Jk|-1
@rhcp011235 @RootJunky you need 3rd party launcher like #Nova or an activity launcher, then Google Play Services -&gt; #AndroidPay and done! :)|1
Make sure you go cop my EP August 14th on Itunes and google play. You can stream it on spotify.https://t.co/wbmpl59Ko3|1
Email From : noreply-212cc8ca@plus.google.com Subject : apurv, a few Google+ posts that you may like|1
I've went over this already @JoeCienkowski I'll set up a Google+ hangout which is a live feed to YouTube. I'll send you the invite Sunday.|1
If it's not a "Larry-sized problem," then why did he pour so much money and resources into Google+?  https://t.co/9oFmyfPwCt|-1
Happy Friday! Have you entered to win the $60 gift card we are giving away next Friday? +1 any 60th anniversary post on our Google+ to win!|1
Getting the most from Google+ for your Business? Join our next Workshop in Derby 10 September http://t.co/isLkoc9eWB http://t.co/2PbiHP1LDQ|1
There's one thing about the changes at Google+ you may have not considered. http://t.co/ZFpG8hWdGS #SocialMediaChat|1
Google is uncoupling its tight integration between Google+ and YouTube, and other changes may be on the way. http://t.co/xz1Q8zT96v|1
14 years in the SEO Industry proving 1st page rankings on Google.  Free Quote. https://t.co/xeqF5VVUU1 #SEO #Google #socialmedia|1
We meet every Thursday to answer the questions asked on the SEO Questions community on Google+ https://t.co/hGlXZzVhoe|1
@MyECheck @e_mobile_pay Liz setup a Google+ page! Tomorrow is going to be an exciting day! https://t.co/g32m54RIey $MYEC :D #AppLauchTuesday|1
Not the same digest in relation to the google android wafer other self january complement other self: ivsH http://t.co/8S1ajpX4iO|1
Tea Salon's 4th Birthday Celebration starts on Google+ in a few minutes.  Must be following the page to see invite:  https://t.co/hL32y6eXHs|1
@InsideTimeUK Was having trouble yesterday downloading Septembers edition using Google? Loads the 1st page then crashes?|-1
The today's photoshoot it will be available on my Google+ profile tomorrow #MPN #ESCREVEAI https://t.co/Ri7UgS5DG2|1
My predictions for the Apple event: Apple have bought Tesla, Uber and Google cars, as of tomorrow car ownership is now a thing of the past.|1
In terms of building segmented lists, then you may appreciate knowing that you can effectively list-build on Google+. #Tip|1
Google+ can enhance your position in Search &amp; connect you with NEW prospects! Interested? http://t.co/a8ipboHLpO Workshop Derby 18 August|1
And Google+ is probably going away....but @Hurrdat sure isn't. Look how you've stood the test of time!!! https://t.co/qm8qk8EjBn|-1
The gap is closing between number one Google and number two Facebook on the top digital-advertising-generating companies and Pandora is 6th|1
Make sure you join our live #InterfaceSpeaks Google Hangout tomorrow &amp; talk all things #ecodesign at 1pm (GMT) http://t.co/AHDhoensX7|1
#KatyPerry, #JohnMayer, #WoodyHarrelson Celebrate Fourth of July with the Grateful Dead http://t.co/ILZxEvjmeT|1
"YouTube description: 1st 2 lines are critical b/c they appear in Google search results (keep keyword at the top)" @Schmittastic #INBOUND15|1
Interesting Sunday read on the rise, fall and rebirth of Google+. http://t.co/87Csxrl8cV|1
Haven't logged in to Google+ since last Sunday and I'm almost hesitant to do so now... what do you think, is it worth it? ;-)|-1
@CarineBouton @fredatlanta @AJHiggi In a Geography class tomorrow with Google @earthoutreach - great starter! #geographyteacher|1
Google hangout anime session @RuffxRaiju  if crunchyroll picks up for the fall season.  https://t.co/pNGWs8LRWQ|1
"Vic has a bias for action. He may need to do more work on strategy." Inside the failure of Google+: http://t.co/kp8Yzytd7B via @mashable|-1
16 useful features on Facebook, Google+, Twitter and LinkedIn you may have missed http://t.co/rM1fOZGH3i http://t.co/bDxE2ZTCcl|1
New mobile number coming Wednesday. DM me for the number or get me on Google+ at https://t.co/SauTPGZolm|1
Not new but worth reading again if you have already: Google's Hiring Wishlist http://t.co/XYZLy0h4nc #learning #cognition|1
Look at this infographic to find Facebook, Twitter, Google+ and LinkedIn features you may not know about! #comm552 http://t.co/IzNlzNmQ0i|1
Google+ is still alive, and it may be the missing tool in your #recruiting toolkit --&gt; http://t.co/zHff0rTCjs via @RecruitingBlogs|1
Google to kill single most annoying thing about browsing the Web August 28 - CNNMoney http://t.co/iw6HPxUZ5X|1
Rumors getting strong Google+ may be going  away. If true I would certainly be sad.|1
Google seems to think the @policesupers site may be hacked? http://t.co/GEMtHocbfK|1
Happy Wednesday! Join us on Google+ today at 3pm Pacific to discuss Modesty with Dive into Worldbuilding! #Worldbuilddive|1
Happy Monday Los Angeles! We are now over 350k views on our Google+ page. See what all the buzz is about! http://t.co/ifEDquy8ha  #cannabis|1
Google+ may finally have the beginnings of a unique value proposition for social media users. http://t.co/8xMbDOVSB9 via @marketingland|1
For your enjoyment, here are Wednesday and Lurch dancing to the Grateful Dead.https://t.co/dscudXQBIs|1
Ryan, a few Google+ posts you may like http://t.co/MFX14Xn9a8|1
And just when I had a few nice things to say about Google+ in my 2nd edition, I've gotta omit it entirely. Much like Google's doing.|-1
Hey everyone,Thanks for hanging out with us last night on google+one more on Thurs, Aug 27 at 7:00pm. don't... http://t.co/B96glQzABZ|1
We just got our 1st #review on google+ Be the next! #socent  http://t.co/FRk6O4iERP http://t.co/gIaHeEBGRV|1
That moment when you think Google search ads for that distortion pedal showed up on your twitter feed. Nope. https://t.co/NVmKBn3pjO|-1
Jokes aside, seeing a bunch of awful alternatives is a good way to get sold on the new Google logo. http://t.co/FyHb3UUWTb|-1
@priya_jyoti15  sure ...keep calm and use google search engine ...may be one day you get what you are looking for :)|1
It looks like Google+ may be on its way out. We can only watch and see over the next few months. It never took off... http://t.co/JpwWhRMEnu|-1
@realmichellet @instagram Do you have a google plus account if so may i have the link to it?|1
ICYMI: The 'failure' of Google+: A round-up of interesting technology-related links you may have missed over t... http://t.co/oTAvvoFQSk|-1
Happy Saturday everyone! Make sure you follow us on TWITTER, INSTAGRAM, &amp; FACEBOOK! We are also on Foursquare, Google+, &amp; Groupon!|1
Google forgot second page, as well forgot many things. The fax. And a bunch of other things.  Told work to expect it on friday|-1
@8ballpool why does it feel like Google+ players are 3rd world citizens? Eg. No dp's for months, no response to my feedback, wtf?|-1
Calling all you deadheads!Head over to the free Grateful Dead tribute concert today, July 25th, from... http://t.co/qbDEOfWLNE|1
I only swipe right for girls named Molly, Mary, or Lucy bc I'm seeing the Grateful Dead on Saturday.|1
EVENT TOMORROW @thebsidedenver: Bluegrass Brunch with The Dead String Band, playing the music of the Grateful Dead http://t.co/MzWw0MdNzG|1
Leaving Texas 4th day of July. Thank you God for inventing Al Gore so we have the technology to listen to a replay of Grateful Dead 7/3/15.|1
I just bought: '30 Trips Around The Sun The Definitive Live Story (1965-1995)' ~ Grateful Dead via @AmazonUK http://t.co/FQPJTsz0EI|1
"Big Monday" was big dud! In the words of Marty Robbins (too old for you youngsters) but often covered by Grateful Dead - El Paso! LAD best?|1
@JohnMayer is gonna play Grateful Dead and I'm very excited about that. I would love to here him try to play some @phish . Mayer may you?|1
http://t.co/jSzM9lSg2R #music Country Joe &amp; the Fish 1st print Bob Masse poster BG,FD,AOR,Grateful Dead|1
HFUnderpants: 6925 ?Aug 27 / 0048+. Taiul end of show with Grateful Dead's "We Will Get By" into station ID as... http://t.co/WXriNUHQt9|1
I love the Grateful Dead. I do not love weed. Just making sure you all know this.  https://t.co/8D05thMF4I|1
September 5th 1979the Grateful Dead performed at NYC's Madison Square Garden (audio)https://t.co/tIBID6ortJ http://t.co/Br1IosFzLt|1
@sportsandra 1) High-life 2) CRAP 3) Grateful Dead for three nights over the 4th of July @ Soldier Field|1
Pleasure: sipping an IPA in the evening sun doing the IT xword while listening to Grateful Dead|1
The Grateful Dead may have laced a TV crew's coffee with LSD. Let's look at the tape! http://t.co/GF6nBJ2gMl|-1
Maybe now you guys understand why I changed my name from Save Hannibal Sam to Hannibal Killed Sam on Thursday night #HannibalMicDrop|1
Down To Eugene to see the Grateful Dead (~);}  David Gans #VibeTribe #Vibes20 #friday #greenvibesstage http://t.co/VWfbHHV061|1
The Reds are having a fireworks show to the Grateful Dead on Friday.|1
Traditional #refractoria curse: may your days &amp; nights be filled with the music of the Grateful Dead.|1
I think I may be the only person alive who prefers the Grateful Dead's studio albums over the live ones|1
I may have a massive love-hate relationship with Hannibal but Bryan Fuller's heart has always been in the right place.|1
ok when I'm sober tomorrow I NEED to talk to people about Hannibal|1
Check it out Saturday - Grateful Dead songs, wine paired http://t.co/LJL6bOCKiO via @MyDelmarvaNow|1
Tomorrow is Grateful Dead night at the #STLCards game! Don't miss @jakeslegstl  performing @STLFSMLive after the game http://t.co/fS0LRiFxIV|1
I have the pool, a PBR, and the Grateful Dead. Couldn't ask for a better first Friday off. Been two years..|1
Looking to bring smiles on a Friday...Did you see the envelope art for the Grateful Dead's 50th anniversary... http://t.co/IAIj0cCsnv|1
Grateful Dead jams in the morn make for good friday vibez.|1
Crowes all day/night at the right tide with the right crew. Sunday papers. Grateful Dead and Bob Marley for music #capeclothconvo|1
Jazz Is Dead - A Jazz Exploration of the Grateful Dead comes to the Music Hall on Friday 8/21. Celebrating the... http://t.co/PbDsXigeLG|1
We're deep in Season 3 of HANNIBAL and Will Graham may have met his match with The Tooth Fairy http://t.co/aHbA8EnCJG http://t.co/fJP8d00hgs|1
Remembering Rock Great Jerry Garcia,co-founder of the Grateful Dead, who we lost on this day August 9th, 1995 at... http://t.co/4azBVDc0vB|1
@neoprod @GillianA @NBCHannibal well you can't do this all by yourself ... Hannibal is inviting to Dinner and Will may finally accepting him|1
August 13 2015/1975: A celebration of 40 years since the Grateful Dead's legendary "One From The... http://t.co/nCtsvjoEKs|1
Grateful Dead Resurrected Once Again, With John Mayer On Guitar: While the Grateful Dead may have reached thei... http://t.co/WpzJczmJmA|1
Grateful Dead Concert Helps Put Chicago at the Top of the July 4th Destina... http://t.co/3Q2eD7p2my|1
@RayWoodson680 The groaning in the 1st inning was that the Grateful Dead shirts had not arrived at the park yet|1
I am honored to be celebrating 50 years of Grateful Dead music at the SF Giants game tomorrow night by singing... http://t.co/IvXJ8pxhUD|1
I may be going to hell in a bucket, baby, but at least I'm enjoying the ride. - Grateful Dead, Hell In A Bucket|1
@trisaarahtop my 1st presidential decree: the national anthem has been changed to a 45 min long improvisation from a Grateful Dead concert|1
Waking up to Grateful Dead playing throughout the house. Happy Friday indeed.|1
@ChadMo1 photo of the press gaggle with @GaryPinkel after Thursday's practice...that's me in the Grateful Dead shirt. http://t.co/SLT0Kjupzo|1
Saturday arvo, sunshine, #homebrew and the Grateful Dead.  Perfect!|1
I would've preferred that episode 4 of Hannibal season 3 was the 2nd episode of it. would've been better to check on everyone earlier.|1
Grateful Dead Open 2nd Set with "Cold, Rain and Snow" https://t.co/N0AJke3MAA via @YouTube|1
Alex Bleeker &amp; the Freaks 2 play some Grateful Dead songs Sun, Aug 9 at noon @ #OutsideLands Panhandle Stage @sfOutsideLands @AlexFreaker|1
Anyone wanna go see some of the members from Grateful Dead and John Mayer on December 30tg|1
New girl at work said she almost quit her job to go see the Grateful Dead for the 3rd time but don't worry, I already took care of the body|1
Old radio commercials for Grateful Dead albums may just be the best thing I've discovered|1
Soundchecking in Grateful Dead Listening Party with Sunshine Daydream, (DVD), Veneta, Oregon, Aug 27 1972 https://t.co/LZdQR679w4|1
Grateful Dead show in San diego on the 7th. Save the date.|1
Shakedown is at Toads this Saturday playing the best of the Grateful Dead.  tickets are still available.... http://t.co/eJ0BYhkSu4|1
Saturday night we welcome Grateful Dead tribute band DeadEye onstage with two sets starting at 7:00! As always at... http://t.co/sfpDNb4bOZ|1
Sunday morning at grandpa's office. Like church but with less hymns and more Grateful Dead. http://t.co/l1SReyQ2fu|1
